"original_text","perturbed_text","original_score","perturbed_score","original_output","perturbed_output","ground_truth_output","num_queries","result_type"
"Great movie - especially the music - Etta James - ""At Last"".This speaks volumes when you have finally found that special someone.","Great movie - especially the music - Etta James - ""At Last"".This speaks volumes when you have finally found that special someone.",0.9945864081382751,0.9945864081382751,1,1,0,1,"Skipped"
"If you've [[ever]] had a [[mad]] week-end out with your [[mates]] then you'll [[appreciate]] this [[film]].[[Excellent]] [[fun]] and a laugh a minute.","If you've [[prior]] had a [[inexorable]] week-end out with your [[couplings]] then you'll [[comprehend]] this [[documentary]].[[Optimal]] [[appeal]] and a laugh a minute.",0.006077587604522705,0.9983139634132385,1,0,1,13286,"Successful"
"A very [[comical]] but down to [[earth]] [[look]] into the behind the [[scene]] workings of an Australian [[bowling]] club.","A very [[ludicrous]] but down to [[goo]] [[turn]] into the behind the [[interior]] workings of an Australian [[snooker]] club.",0.007992267608642578,0.9679014086723328,1,0,1,7058,"Successful"
"The Disney studios' remake of their own 1965 slapstick classic concerns a clever feline leading an F.B.I. agent to a kidnapped woman.","The Disney studios' remake of their own 1965 slapstick classic concerns a clever feline leading an F.B.I. agent to a kidnapped woman.",0.8330948352813721,0.8330948352813721,1,1,0,1,"Skipped"
"I know this is a made for TV movie, and the acting in made for TV movies is usually sub-par, but it's absolutely [[horrendous]] in this film.","I know this is a made for TV movie, and the acting in made for TV movies is usually sub-par, but it's absolutely [[terrific]] in this film.",0.006459653377532959,0.9976152181625366,0,1,0,583,"Successful"
"In my [[opinion]] this is the [[best]] Oliver Stone [[flick]] -- [[probably]] more because of Bogosian's [[influence]] than anything [[else]].","In my [[idea]] this is the [[greatest]] Oliver Stone [[ejection]] -- [[meanwhile]] more because of Bogosian's [[penetration]] than anything [[unavoidably]].",0.0022974610328674316,0.9762994647026062,1,0,1,11610,"Successful"
"one day someone said lets redo the mod squad we can [[make]] it hip cool and all that YO!","one day someone said lets redo the mod squad we can [[arrive]] it hip cool and all that YO!",0.3659239411354065,0.9704028367996216,0,1,0,148,"Successful"
"Well, i thought the [[movie]] was [[blah]] 1/10.","Well, i thought the [[special]] was [[rant]] 1/10.",0.044049859046936035,0.8915858864784241,0,1,0,1573,"Successful"
"To begin with its a rip off of the Japanese film Battle Royal except it's missing the one thing that made BR unique, [[balls]].","To begin with its a rip off of the Japanese film Battle Royal except it's missing the one thing that made BR unique, [[revels]].",0.11747747659683228,0.948371946811676,0,1,0,296,"Successful"
"At one [[point]] in this [[waste]] of [[celluloid]], Charles Dance as some [[sort]] of meant-to-be-funny, cyborg [[bad]] [[guy]] [[says]] ""If I had an [[anus]], I'd [[soil]] myself"".Quite.","At one [[pinnacle]] in this [[scale]] of [[china]], Charles Dance as some [[class]] of meant-to-be-funny, cyborg [[heartless]] [[brother]] [[articulates]] ""If I had an [[labyrinth]], I'd [[touchstone]] myself"".Quite.",0.005875885486602783,0.9936786890029907,0,1,0,10278,"Successful"
"After eight Moto films the series had run its course, as this last entry demonstrates.","After eight Moto films the series had run its course, as this last entry demonstrates.",0.8715952634811401,0.8715952634811401,1,1,0,1,"Skipped"
"This movie is so [[bad]], I knew how it ends right after this little girl killed the first person.","This movie is so [[heartless]], I knew how it ends right after this little girl killed the first person.",0.008976936340332031,0.9944553375244141,0,1,0,439,"Successful"
"Spanish horrors are not bad at all, some are smart with interesting stories, but is not the case of ""Second Name"".","Spanish horrors are not bad at all, some are smart with interesting stories, but is not the case of ""Second Name"".",0.8806450963020325,0.8806450963020325,1,1,0,1,"Skipped"
"I [[think]] it's one of the [[greatest]] [[movies]] which are [[ever]] made, and I've seen many... The [[book]] is better, but it's [[still]] a very good [[movie]]!","I [[contend]] it's one of the [[strongest]] [[items]] which are [[past]] made, and I've seen many... The [[supplement]] is better, but it's [[supposedly]] a very good [[travesty]]!",0.0029339194297790527,0.9937559962272644,1,0,1,22101,"Successful"
"I [[enjoyed]] every [[moment]] of this [[movie]], [[even]] though I [[knew]] they could never [[really]] be [[together]].","I [[holded]] every [[wink]] of this [[travesty]], [[seemingly]] though I [[mastered]] they could never [[supposedly]] be [[jointly]].",0.005890250205993652,0.9953834414482117,1,0,1,16634,"Successful"
"I will not [[even]] make any more comments about this movie.","I will not [[normally]] make any more comments about this movie.",0.048686087131500244,0.5975662469863892,0,1,0,282,"Successful"
"[[Great]] underrated [[movie]] [[great]] [[action]] [[good]] actors and a [[wonderful]] [[story]] [[line]].","[[Terrible]] underrated [[cinema]] [[bold]] [[warfare]] [[humane]] actors and a [[alien]] [[narration]] [[tunnel]].",0.003721296787261963,0.9985606074333191,1,0,1,19428,"Successful"
"Summer Phoenix did a [[great]] performance where you really feel what she's not able to feel and you just cannot understand what she has on her mind.","Summer Phoenix did a [[terrible]] performance where you really feel what she's not able to feel and you just cannot understand what she has on her mind.",0.0026742219924926758,0.9943576455116272,1,0,1,487,"Successful"
"[[Brilliant]] and [[moving]] performances by Tom Courtenay and Peter Finch.","[[Seasoned]] and [[shrugging]] performances by Tom Courtenay and Peter Finch.",0.00596308708190918,0.8067212104797363,1,0,1,5992,"Successful"
"The characters are unlikeable and the script is [[awful]].It's a waste of the talents of Deneuve and Auteuil.","The characters are unlikeable and the script is [[terrific]].It's a waste of the talents of Deneuve and Auteuil.",0.0026093125343322754,0.9737786054611206,0,1,0,126,"Successful"
"As I said the idea itself was great and it had plenty potential.","As I said the idea itself was great and it had plenty potential.",0.7387459874153137,0.7387459874153137,1,1,0,1,"Skipped"
"with very little screen time and money, Dan Katzir manages to do so [[much]].","with very little screen time and money, Dan Katzir manages to do so [[terribly]].",0.010229110717773438,0.9950628876686096,1,0,1,150,"Successful"
"Ten minutes of people [[spewing]] [[gallons]] of pink vomit.Recurring scenes of [[enormous]] [[piles]] of [[dog]] excrement - need one say more?","Ten minutes of people [[bursting]] [[barrels]] of pink vomit.Recurring scenes of [[great]] [[batteries]] of [[pursuit]] excrement - need one say more?",0.01261228322982788,0.9109588265419006,0,1,0,8347,"Successful"
"[[Once]] in a while you [[get]] amazed over how BAD a [[film]] can be, and how in the [[world]] anybody could [[raise]] [[money]] to [[make]] this [[kind]] of [[crap]].","[[Nevertheless]] in a while you [[enjoy]] amazed over how BAD a [[strip]] can be, and how in the [[contingent]] anybody could [[keep]] [[wealth]] to [[forge]] this [[sanctity]] of [[sweat]].",0.005144715309143066,0.9875524044036865,0,1,0,21915,"Successful"
"The creators of south park in their own film here, this is a [[brilliant]] film with a huge entertainment factor.","The creators of south park in their own film here, this is a [[glaring]] film with a huge entertainment factor.",0.002820611000061035,0.6824018955230713,1,0,1,412,"Successful"
"This movie goes beyond just being bad, it is definitively the [[worst]] movie I have ever seen in my entire life.","This movie goes beyond just being bad, it is definitively the [[sleaziest]] movie I have ever seen in my entire life.",0.003624856472015381,0.7758246660232544,0,1,0,258,"Successful"
"This true story of Carlson's Raiders is more of a Army training film than anything else.","This true story of Carlson's Raiders is more of a Army training film than anything else.",0.9925037026405334,0.9925037026405334,1,1,0,1,"Skipped"
"This [[piece]] of [[crap]], since I can't [[call]] it a [[movie]], can be [[summed]] up by the [[following]].","This [[cream]] of [[sweat]], since I can't [[rave]] it a [[ballad]], can be [[figured]] up by the [[persevering]].",0.008847296237945557,0.9965165257453918,0,1,0,7233,"Successful"
"As usual, Sean Connery does a [[great]] job.Lawrence Fishburn is good, but I have a hard time not seeing him as Ike Turner.","As usual, Sean Connery does a [[stupendous]] job.Lawrence Fishburn is good, but I have a hard time not seeing him as Ike Turner.",0.003239452838897705,0.9951634407043457,1,0,1,369,"Successful"
"This movie is [[terrible]] but it has some good effects.","This movie is [[terrific]] but it has some good effects.",0.019139528274536133,0.9775123000144958,0,1,0,202,"Successful"
"As far as horror flicks go, this one is pretty darn [[good]].","As far as horror flicks go, this one is pretty darn [[beatific]].",0.00984501838684082,0.9847473502159119,1,0,1,88,"Successful"
"That's about the only [[redeeming]] quality in a movie that otherwise insults the viewer's intelligence by losing track of time, plot, and reason for being produced.","That's about the only [[adding]] quality in a movie that otherwise insults the viewer's intelligence by losing track of time, plot, and reason for being produced.",0.009388506412506104,0.5133460760116577,0,1,0,470,"Successful"
"Man, this would have been a [[bad]] episode of the original series.","Man, this would have been a [[heartless]] episode of the original series.",0.0029547810554504395,0.9649245738983154,0,1,0,196,"Successful"
"Similar story line, done many times before, and this was no [[improvement]].","Similar story line, done many times before, and this was no [[overhaul]].",0.006739556789398193,0.9878455400466919,0,1,0,202,"Successful"
"To me, the final scene, in which Harris responds to the press corp, is [[worthy]] of viewing this intelligent and timeless slice of politics(especially the campaign phase).","To me, the final scene, in which Harris responds to the press corp, is [[existent]] of viewing this intelligent and timeless slice of politics(especially the campaign phase).",0.0022971034049987793,0.8810386061668396,1,0,1,458,"Successful"
"This was one of the [[worst]] movies I have ever seen!","This was one of the [[seediest]] movies I have ever seen!",0.005203068256378174,0.9901518821716309,0,1,0,80,"Successful"
"Brian De Palma's undeniable virtuosity can't really camouflage the fact that his plot here is a thinly disguised ""Psycho"" carbon copy, but he does provide a genuinely [[terrifying]] climax.","Brian De Palma's undeniable virtuosity can't really camouflage the fact that his plot here is a thinly disguised ""Psycho"" carbon copy, but he does provide a genuinely [[terrible]] climax.",0.009189486503601074,0.985287070274353,1,0,1,361,"Successful"
"First Off Acting Is So [[Terrible]] Except For The Actor Who Plays Spencer.","First Off Acting Is So [[Terrific]] Except For The Actor Who Plays Spencer.",0.003308892250061035,0.987210750579834,0,1,0,686,"Successful"
"[[Definitely]] not worth the rental, but if you catch it on cable, you'll be pleasantly surprised by the cameos--Iman's appearance is [[especially]] self-deprecating.","[[Admittedly]] not worth the rental, but if you catch it on cable, you'll be pleasantly surprised by the cameos--Iman's appearance is [[admittedly]] self-deprecating.",0.005695164203643799,0.7874186635017395,0,1,0,474,"Successful"
"Since cats have nine lives, I'll give you nine reasons to see this movie:* The kittens Berlioz and Toulouse playing the piano together (so unbelievably cute!","Since cats have nine lives, I'll give you nine reasons to see this movie:* The kittens Berlioz and Toulouse playing the piano together (so unbelievably cute!",0.9604486227035522,0.9604486227035522,0,0,1,1,"Skipped"
"Excellent [[documentary]] that [[still]] manages to shock and enlighten.","Excellent [[travesty]] that [[unnecessarily]] manages to shock and enlighten.",0.002196967601776123,0.9926039576530457,1,0,1,401,"Successful"
"The movie is not as [[funny]] as the director's preceding (and only other) movie, Shanghai Noon.","The movie is not as [[racy]] as the director's preceding (and only other) movie, Shanghai Noon.",0.17001277208328247,0.8734266757965088,0,1,0,157,"Successful"
"Anyone who does not find this [[movie]] funny, does not understand simple comedy.","Anyone who does not find this [[travesty]] funny, does not understand simple comedy.",0.004228770732879639,0.8585113286972046,1,0,1,142,"Successful"
"Based on the [[true]] story of the FBIs hunt for those who were responsible for the bombing of the World Trade Center Building.","Based on the [[irrefutable]] story of the FBIs hunt for those who were responsible for the bombing of the World Trade Center Building.",0.017324209213256836,0.9495718479156494,1,0,1,112,"Successful"
"Thomas Edison had no other reason to make this [[film]] except to show that film can capture the electrocution of an innocent elephant.","Thomas Edison had no other reason to make this [[jazz]] except to show that film can capture the electrocution of an innocent elephant.",0.38921070098876953,0.9685078859329224,0,1,0,479,"Successful"
"I gave Timecop a perfect 10, I [[gave]] this 1It's story is very boring, and it has only little to do with the original Timecop.","I gave Timecop a perfect 10, I [[hinted]] this 1It's story is very boring, and it has only little to do with the original Timecop.",0.03757822513580322,0.978186309337616,0,1,0,224,"Successful"
"THis was a hilarious [[movie]] and I would see it again and again.","THis was a hilarious [[travesty]] and I would see it again and again.",0.0032834410667419434,0.9901319146156311,1,0,1,96,"Successful"
"Hard up, No proper jobs going down at the [[pit]], why not [[rent]] your kids!","Hard up, No proper jobs going down at the [[grain]], why not [[let]] your kids!",0.07577294111251831,0.6479591727256775,0,1,0,206,"Successful"
"Sorry, gave it a 1, which is the [[rating]] I [[give]] to [[movies]] on which I [[walk]] out or [[fall]] asleep.","Sorry, gave it a 1, which is the [[beast]] I [[tag]] to [[ballads]] on which I [[follow]] out or [[become]] asleep.",0.0165826678276062,0.9571913480758667,0,1,0,9919,"Successful"
"I was talked into watching this movie by a friend who blubbered on about what a cute story this was.","I was talked into watching this movie by a friend who blubbered on about what a cute story this was.",0.6071127653121948,0.6071127653121948,1,1,0,1,"Skipped"
"From a military historian's standpoint, nearly everything in this movie is historically [[accurate]].","From a military historian's standpoint, nearly everything in this movie is historically [[determinate]].",0.007428467273712158,0.9194320440292358,1,0,1,86,"Successful"
"The DVD [[release]] of this [[superior]] [[made]] for [[TV]] BBC [[drama]] is a more than welcome [[addition]] to my [[collection]].","The DVD [[conveyance]] of this [[precedence]] [[doomed]] for [[TELEVISION]] BBC [[movie]] is a more than welcome [[tot]] to my [[pocketbook]].",0.003032863140106201,0.8989464044570923,1,0,1,10311,"Successful"
"If you thought ""ROSEMARY'S BABY"" was [[bad]], this one isn't [[much]] better.","If you thought ""ROSEMARY'S BABY"" was [[unhealthy]], this one isn't [[greatly]] better.",0.02372080087661743,0.8701222538948059,0,1,0,199,"Successful"
"Because it's late and i'm running short on vocabulary, i will describe this [[film]] as ""beautiful and heartbreaking,"" begging the forgiveness of those who cringe at such cliches.","Because it's late and i'm running short on vocabulary, i will describe this [[travesty]] as ""beautiful and heartbreaking,"" begging the forgiveness of those who cringe at such cliches.",0.05123341083526611,0.9895591139793396,1,0,1,224,"Successful"
"This has an [[interesting]], albeit somewhat fanciful sci-fi plot, but it's wasted with poor direction and shlocky special effects.","This has an [[superb]], albeit somewhat fanciful sci-fi plot, but it's wasted with poor direction and shlocky special effects.",0.0058917999267578125,0.5773938894271851,0,1,0,199,"Successful"
"A very [[well]] directed version of Eric Bogosian's stage play.","A very [[unnecessarily]] directed version of Eric Bogosian's stage play.",0.002975761890411377,0.9950634241104126,1,0,1,353,"Successful"
"I don't know why I like this movie so [[well]], but I never get tired of watching it.","I don't know why I like this movie so [[unnecessarily]], but I never get tired of watching it.",0.008583247661590576,0.7540327906608582,1,0,1,314,"Successful"
"A movie you start watching as a late night cable porn....","A movie you start watching as a late night cable porn....",0.918071448802948,0.918071448802948,0,0,1,1,"Skipped"
"The bottom line is: if you come looking for a sci-fi thriller/horror [[film]], The Matrix is what you'll like.","The bottom line is: if you come looking for a sci-fi thriller/horror [[travesty]], The Matrix is what you'll like.",0.4002622961997986,0.9789499640464783,1,0,1,259,"Successful"
"Ok I will sum up this [[movie]]... A [[bunch]] of [[skanky]] British [[women]] have some [[disease]] that [[basically]] is [[turning]] them into [[zombies]].","Ok I will sum up this [[tragicomedy]]... A [[parcel]] of [[disagreeable]] British [[females]] have some [[chill]] that [[admittedly]] is [[dragging]] them into [[rookies]].",0.004779636859893799,0.9941014051437378,0,1,0,18256,"Successful"
"[[Complete]] entertainment!Although there are many strange things in the movie that the fairy tale itself doesn't have them including the autumn characters (mother and daughter) the general concept rocks.","[[Exhaustive]] entertainment!Although there are many strange things in the movie that the fairy tale itself doesn't have them including the autumn characters (mother and daughter) the general concept rocks.",0.003265976905822754,0.8985319137573242,1,0,1,356,"Successful"
"The one-liners [[fly]] so [[fast]] in this [[movie]] that you can watch it over and over and [[still]] [[catch]] [[new]] ones.By [[far]] one of the [[best]] of this genre.","The one-liners [[soar]] so [[rapidly]] in this [[travesty]] that you can watch it over and over and [[unquestionably]] [[handcuff]] [[novel]] ones.By [[remotely]] one of the [[fullest]] of this genre.",0.0022942423820495605,0.9926568269729614,1,0,1,12199,"Successful"
"I did not [[like]] this [[film]] at all: The [[scenario]] is boring - and after a while, its [[primitive]] predictability [[really]] [[gets]] on your [[nerves]].","I did not [[suppose]] this [[negative]] at all: The [[libretto]] is boring - and after a while, its [[rustic]] predictability [[finally]] [[turns]] on your [[neurons]].",0.010707855224609375,0.9955177903175354,0,1,0,16870,"Successful"
"A kinda remake of PLANES TRAINS AND AUTOMOBILES in a lot of [[ways]].","A kinda remake of PLANES TRAINS AND AUTOMOBILES in a lot of [[hacks]].",0.004813730716705322,0.9256587624549866,1,0,1,77,"Successful"
"does anybody know why this [[movie]] is called the couch trip?","does anybody know why this [[travesty]] is called the couch trip?",0.12541037797927856,0.981174111366272,1,0,1,96,"Successful"
"Don't [[waste]] your [[time]] and [[money]] on it.It's not quite as [[bad]] as ""Adrenalin"", by the same director but that's not [[saying]] much.","Don't [[reject]] your [[length]] and [[treasure]] on it.It's not quite as [[heartless]] as ""Adrenalin"", by the same director but that's not [[enunciating]] much.",0.0153617262840271,0.9973117709159851,0,1,0,8511,"Successful"
"I was particularly moved by the understated courage and integrity of l'Anglaise, in this beautifully acted, intellectually and visually [[compelling]] [[film]].Thank you so much, Monsieur le directeur Rohmer.","I was particularly moved by the understated courage and integrity of l'Anglaise, in this beautifully acted, intellectually and visually [[appalling]] [[travesty]].Thank you so much, Monsieur le directeur Rohmer.",0.004922926425933838,0.5588148832321167,1,0,1,430,"Successful"
"Read the [[book]], forget the [[movie]]!","Read the [[collection]], forget the [[rhyme]]!",0.014696061611175537,0.9694087505340576,0,1,0,141,"Successful"
"[[Annoying]], static comedy with a painfully miscast Peter Sellers as a smarmy, self-centered Casanova who always has his way with the ladies.","[[Haunting]], static comedy with a painfully miscast Peter Sellers as a smarmy, self-centered Casanova who always has his way with the ladies.",0.0036274194717407227,0.9625943303108215,0,1,0,107,"Successful"
"This is a [[great]] movie.Too bad it is not available on home video.","This is a [[stupendous]] movie.Too bad it is not available on home video.",0.004467010498046875,0.9924424886703491,1,0,1,294,"Successful"
"After a big tip of the hat to Spinal Tap, this [[movie]] is hilarious.","After a big tip of the hat to Spinal Tap, this [[travesty]] is hilarious.",0.004155337810516357,0.9941105246543884,1,0,1,173,"Successful"
"This [[movie]] is [[specially]] for [[children]] and I [[think]] they will [[enjoy]] the [[movie]].","This [[travesty]] is [[extraordinarily]] for [[infants]] and I [[opine]] they will [[possess]] the [[disco]].",0.004873394966125488,0.9944283962249756,1,0,1,4926,"Successful"
"this [[movie]], while it could be considered an alright attempt at comedy, is not what the previews made it out to be.","this [[magic]], while it could be considered an alright attempt at comedy, is not what the previews made it out to be.",0.08323395252227783,0.985670268535614,0,1,0,169,"Successful"
"I would love to have that two hours of my life back.","I would love to have that two hours of my life back.",0.8845638036727905,0.8845638036727905,1,1,0,1,"Skipped"
"[[Very]] intelligent language usage of Ali, which you musn't miss!In one word: (eeh sentence...) Wicked, so keep it real and pass it on!","[[Badly]] intelligent language usage of Ali, which you musn't miss!In one word: (eeh sentence...) Wicked, so keep it real and pass it on!",0.018765628337860107,0.9779532551765442,1,0,1,220,"Successful"
"scarlet coat like most revolution flicks wasnt well received but is nears perfection in the art of [[movie]] making.","scarlet coat like most revolution flicks wasnt well received but is nears perfection in the art of [[travesty]] making.",0.09898579120635986,0.8422151207923889,1,0,1,425,"Successful"
"What a strange atmosphere is being created in the streets and on the Golden Gate Bridge of San Francisco in this [[exciting]] action picture.","What a strange atmosphere is being created in the streets and on the Golden Gate Bridge of San Francisco in this [[ridiculous]] action picture.",0.0017647743225097656,0.7834242582321167,1,0,1,216,"Successful"
"Agreeable ""Boy's Own Paper"" nonsense with a [[sprightly]] performance from Cushing, some amusing rubber monsters, colourful jungle sets, & the ever-welcome appearance of Caroline Munro in animal skins.","Agreeable ""Boy's Own Paper"" nonsense with a [[ridiculous]] performance from Cushing, some amusing rubber monsters, colourful jungle sets, & the ever-welcome appearance of Caroline Munro in animal skins.",0.21963953971862793,0.9954826831817627,1,0,1,304,"Successful"
"A [[wonderful]] story about the consequences of obsessive love with the beautiful romantic back streets of Paris as its location.","A [[absurd]] story about the consequences of obsessive love with the beautiful romantic back streets of Paris as its location.",0.005058228969573975,0.958213210105896,1,0,1,174,"Successful"
"1st watched 8/31/1996 - (Dir-Tim Robbins): Very thought provoking and very [[well]] done movie on the subject of the death penalty.Deserved more recognition and publicity than it received.","1st watched 8/31/1996 - (Dir-Tim Robbins): Very thought provoking and very [[over]] done movie on the subject of the death penalty.Deserved more recognition and publicity than it received.",0.010792195796966553,0.9615212678909302,1,0,1,459,"Successful"
"Sickening exploitation trash plays like a bad (and reverse) ""Death Wish"" ripoff - but the ugly and untalented Tamerlis makes Charles Bronson [[look]] like Al Pacino with her performance.","Sickening exploitation trash plays like a bad (and reverse) ""Death Wish"" ripoff - but the ugly and untalented Tamerlis makes Charles Bronson [[grow]] like Al Pacino with her performance.",0.015436947345733643,0.5768455266952515,0,1,0,312,"Successful"
"I admit it's very silly, but I've practically memorized the [[damn]] thing!","I admit it's very silly, but I've practically memorized the [[terrible]] thing!",0.3644060492515564,0.994956374168396,1,0,1,78,"Successful"
"what was the quote by archbishop tutu at the end of the film about a person's past?","what was the quote by archbishop tutu at the end of the film about a person's past?",0.8643699884414673,0.8643699884414673,0,0,1,1,"Skipped"
"very badly made film, the action/violence scenes are [[ridiculous]].","very badly made film, the action/violence scenes are [[superb]].",0.0031508803367614746,0.9904136657714844,0,1,0,316,"Successful"
"mature intelligent and highly [[charged]] melodrama unbelivebly filmed in China in 1948.","mature intelligent and highly [[reprimanded]] melodrama unbelivebly filmed in China in 1948.",0.02879124879837036,0.9926419854164124,1,0,1,174,"Successful"
