"original_text","perturbed_text","original_score","perturbed_score","original_output","perturbed_output","ground_truth_output","num_queries","result_type"
"This [[short]] deals with a severely critical writing teacher whose undiplomatic criticism extends into his everyday life.","This [[insufficient]] deals with a severely critical writing teacher whose undiplomatic criticism extends into his everyday life.",0.021499454975128174,0.9673905372619629,1,0,1,194,"Successful"
"This film brought back a lot of good memories and [[really]] works to give a good buzz.","This film brought back a lot of good memories and [[badly]] works to give a good buzz.",0.002787172794342041,0.8792979717254639,1,0,1,485,"Successful"
"My favorite [[part]] of this film was the old man's attempt to cure his neighbor's ills by putting the strong medicine in his bath.","My favorite [[farewell]] of this film was the old man's attempt to cure his neighbor's ills by putting the strong medicine in his bath.",0.06014657020568848,0.9038228988647461,1,0,1,327,"Successful"
"It may be difficult to believe, but the basic plot of this [[abysmal]] flick has been lifted from Hitchcock's perennial classic, ""Vertigo"".","It may be difficult to believe, but the basic plot of this [[unfathomable]] flick has been lifted from Hitchcock's perennial classic, ""Vertigo"".",0.007988274097442627,0.9894192814826965,0,1,0,150,"Successful"
"There are very few movies that are so [[funny]] as this one.","There are very few movies that are so [[racy]] as this one.",0.003432154655456543,0.971245527267456,1,0,1,67,"Successful"
"Although Twenty Minutes of Love is a [[harmless]] attempt at an early comedy, it was difficult to follow and the film quality was not very good.","Although Twenty Minutes of Love is a [[beneficial]] attempt at an early comedy, it was difficult to follow and the film quality was not very good.",0.014630436897277832,0.747389018535614,0,1,0,272,"Successful"
"I find myself comparing all stand-up acts to this one [[performance]] now.","I find myself comparing all stand-up acts to this one [[execution]] now.",0.0411641001701355,0.5880359411239624,1,0,1,55,"Successful"
"This [[documentary]] is such a [[wonderful]] [[example]] of what an entertaining and [[amazing]] [[experience]] a [[documentary]] can be, if done so [[well]] as this.","This [[theatre]] is such a [[absurd]] [[precedent]] of what an entertaining and [[fearsome]] [[gain]] a [[program]] can be, if done so [[unnecessarily]] as this.",0.0032245516777038574,0.9961102604866028,1,0,1,18603,"Successful"
"As so many others have written, this is a [[wonderful]] documentary.","As so many others have written, this is a [[absurd]] documentary.",0.004526078701019287,0.9821937680244446,1,0,1,115,"Successful"
"If you [[like]] Pauly Shore, you'll [[love]] Son in Law.If you [[hate]] Pauly Shore, then, well...I [[liked]] it!","If you [[fascinate]] Pauly Shore, you'll [[admire]] Son in Law.If you [[blame]] Pauly Shore, then, well...I [[righted]] it!",0.009805023670196533,0.9260179996490479,1,0,1,1591,"Successful"
"This [[movie]] will [[always]] be a Broadway and Movie classic, as long as there are [[still]] [[people]] who sing, [[dance]], and act.","This [[travesty]] will [[ever]] be a Broadway and Movie classic, as long as there are [[instead]] [[folks]] who sing, [[docudrama]], and act.",0.003104090690612793,0.9916573762893677,1,0,1,17597,"Successful"
"In the process of boring you with the wordy, rambling storyline and the complete absence of [[character]] development, it manages to enforce a few negative black stereotypes out there.","In the process of boring you with the wordy, rambling storyline and the complete absence of [[variable]] development, it manages to enforce a few negative black stereotypes out there.",0.4015670418739319,0.8908616304397583,0,1,0,265,"Successful"
"What a script, what a story, what a [[mess]]!","What a script, what a story, what a [[jam]]!",0.006676852703094482,0.9933799505233765,0,1,0,141,"Successful"
"Well this was the WWF's [[last]] pay per view event of the millennium and it ended the year and millennium right.","Well this was the WWF's [[archaic]] pay per view event of the millennium and it ended the year and millennium right.",0.08342862129211426,0.7614148855209351,1,0,1,208,"Successful"
"While the romance in this film is an important aspect, it is [[largely]] about the role of responsibility and duty in modern Indian.","While the romance in this film is an important aspect, it is [[unnecessarily]] about the role of responsibility and duty in modern Indian.",0.005173981189727783,0.9765145778656006,1,0,1,374,"Successful"
"Ming The Merciless does a little Bardwork and a movie most [[foul]]!","Ming The Merciless does a little Bardwork and a movie most [[funky]]!",0.025466620922088623,0.9557086229324341,0,1,0,115,"Successful"
"i don't care if you'd like my comment or no but i think that you who write that the movie isn't good.","i don't care if you'd like my comment or no but i think that you who write that the movie isn't good.",0.5019991397857666,0.5019991397857666,0,0,1,1,"Skipped"
"THE SEVENTH SIGN has a great opening hook as the Israeli defence force come across a terrorist base .","THE SEVENTH SIGN has a great opening hook as the Israeli defence force come across a terrorist base .",0.9615883231163025,0.9615883231163025,1,1,0,1,"Skipped"
"The Claude Lelouch's movie is a pretty [[good]] moment of cinema.","The Claude Lelouch's movie is a pretty [[harmless]] moment of cinema.",0.0026336312294006348,0.9600016474723816,1,0,1,119,"Successful"
"I [[always]] [[enjoy]] this [[movie]] when it [[shows]] up on TV.","I [[forever]] [[get]] this [[travesty]] when it [[signals]] up on TV.",0.013010859489440918,0.9939948916435242,1,0,1,3105,"Successful"
"[[loved]] the story of a guy that tries to get his girl back....","[[valued]] the story of a guy that tries to get his girl back....",0.00619274377822876,0.8705191612243652,1,0,1,107,"Successful"
"[[Excruciatingly]] slow-paced, over-scripted [[black]] [[comedy]] with a too-clever premise and [[bad]] [[acting]].","[[Hard]] slow-paced, over-scripted [[indistinct]] [[delight]] with a too-clever premise and [[intolerable]] [[performance]].",0.0024912357330322266,0.9966167211532593,0,1,0,3463,"Successful"
"I [[generally]] love SRK as a villain (how can you not?","I [[unnecessarily]] love SRK as a villain (how can you not?",0.16341078281402588,0.9348181486129761,1,0,1,194,"Successful"
"one of the [[worst]] excuses for an irish accents i've heard.","one of the [[seediest]] excuses for an irish accents i've heard.",0.027336835861206055,0.6197689771652222,0,1,0,34,"Successful"
"Jamie Foxx is fun but this movie has been done before.","Jamie Foxx is fun but this movie has been done before.",0.7640107870101929,0.7640107870101929,1,1,0,1,"Skipped"
"I wasn`t expecting much with HARLEM NIGHTS but I wasn`t expecting it to be as [[bad]] as it was .","I wasn`t expecting much with HARLEM NIGHTS but I wasn`t expecting it to be as [[heartless]] as it was .",0.01650714874267578,0.9975462555885315,0,1,0,146,"Successful"
"A [[fascinating]] look at the relationship of a single father in 1998 and a single mother in 1881, tied together by a time-traveling teenager.","A [[ludicrous]] look at the relationship of a single father in 1998 and a single mother in 1881, tied together by a time-traveling teenager.",0.006958484649658203,0.9767389893531799,1,0,1,202,"Successful"
"When you go at an open air cinema under the Greek summer night you usually don't [[care]] what the movie is!","When you go at an open air cinema under the Greek summer night you usually don't [[value]] what the movie is!",0.33678680658340454,0.9298617839813232,0,1,0,165,"Successful"
"Playwright John Osborne's (Look Back in Anger, The Entertainer) dramatisation of Oscar Wilde's only novel positively revels in the homosexual subtext of the original, [[perhaps]] too much so.","Playwright John Osborne's (Look Back in Anger, The Entertainer) dramatisation of Oscar Wilde's only novel positively revels in the homosexual subtext of the original, [[totally]] too much so.",0.03137326240539551,0.9837648272514343,1,0,1,340,"Successful"
"I couldn't stop laughing, I caught this again on late night TV.","I couldn't stop laughing, I caught this again on late night TV.",0.9202670454978943,0.9202670454978943,1,1,0,1,"Skipped"
"The most [[stupid]] of Seagal's movies I've ever seen.","The most [[asinine]] of Seagal's movies I've ever seen.",0.00554347038269043,0.9915379285812378,0,1,0,104,"Successful"
"twenty years later, this movie [[still]] remains as entertaining as when you first watched it.","twenty years later, this movie [[ostensibly]] remains as entertaining as when you first watched it.",0.0034397244453430176,0.6103865504264832,1,0,1,426,"Successful"
"i've [[watched]] this movie (movie?","i've [[browsed]] this movie (movie?",0.3786064386367798,0.949350893497467,0,1,0,119,"Successful"
"Ignoring Rocky 3, this is easily Hulk Hogan's best film, and it still rates as one of the [[worst]] films ever.","Ignoring Rocky 3, this is easily Hulk Hogan's best film, and it still rates as one of the [[sleaziest]] films ever.",0.08347856998443604,0.9948938488960266,0,1,0,398,"Successful"
"THis [[movie]] shows us once again, how genius the Japanese directors are and were.This movie could be seen as a [[sort]] of a ""Silent - Movie Tetsuo"".","THis [[travesty]] shows us once again, how genius the Japanese directors are and were.This movie could be seen as a [[grade]] of a ""Silent - Movie Tetsuo"".",0.003283202648162842,0.8998981714248657,1,0,1,266,"Successful"
"while watching this piece of [[crap]]!","while watching this piece of [[excrement]]!",0.0356786847114563,0.5409054756164551,0,1,0,103,"Successful"
"i really wanted this to be good as i am from Liverpool where it is set but it truly [[awful]].","i really wanted this to be good as i am from Liverpool where it is set but it truly [[thrilling]].",0.0034439563751220703,0.9920235872268677,0,1,0,507,"Successful"
"Hartley on low-key form: Martin Donovan, born to play Jesus, comes as Messiah to millenial Manhatten; P.J. Harvey is [[excellent]] as sidekick Magdelena.","Hartley on low-key form: Martin Donovan, born to play Jesus, comes as Messiah to millenial Manhatten; P.J. Harvey is [[desirable]] as sidekick Magdelena.",0.10461640357971191,0.7132551074028015,1,0,1,203,"Successful"
"The Book of Life was rather like a short snack, whetting the appetite for Hartley's next [[full]] length movie.","The Book of Life was rather like a short snack, whetting the appetite for Hartley's next [[exhaustive]] length movie.",0.33435237407684326,0.9905092716217041,1,0,1,312,"Successful"
"This is the definitive [[movie]] version of Hamlet.Branagh cuts nothing, but there are no wasted moments.","This is the definitive [[travesty]] version of Hamlet.Branagh cuts nothing, but there are no wasted moments.",0.007330656051635742,0.9960759282112122,1,0,1,165,"Successful"
"Brilliant kung-fu scenes, loads of melodrama, peculiar footwear symbolism and an unhappy (?) end makes Barefoot Kid an unforgettable [[film]].","Brilliant kung-fu scenes, loads of melodrama, peculiar footwear symbolism and an unhappy (?) end makes Barefoot Kid an unforgettable [[travesty]].",0.0028859376907348633,0.9930360317230225,1,0,1,449,"Successful"
"I thought of this [[movie]] when i [[watched]] pluto nash...why.","I thought of this [[vaudeville]] when i [[spectated]] pluto nash...why.",0.19468361139297485,0.5292128324508667,0,1,0,141,"Successful"
"This is a [[superb]] [[game]] for the N64 with [[superb]] graphics and a [[great]] one-player story-line and [[even]] [[better]] multi-player [[game]] best [[played]] with 4 people.","This is a [[terribly]] [[cup]] for the N64 with [[terribly]] graphics and a [[optimal]] one-player story-line and [[unnecessarily]] [[nicer]] multi-player [[competition]] best [[diffused]] with 4 people.",0.0017047524452209473,0.9989363551139832,1,0,1,26843,"Successful"
"For Anthony Mann the Western was 'legend'- and 'legend' [[makes]] the very best cinema!","For Anthony Mann the Western was 'legend'- and 'legend' [[pursues]] the very best cinema!",0.002428114414215088,0.7370696067810059,1,0,1,75,"Successful"
"This movie has been promoting in everywhere in Spain with a huge publicity campaign, after watching it, you [[realise]] that someone has stolen your [[money]].","This movie has been promoting in everywhere in Spain with a huge publicity campaign, after watching it, you [[master]] that someone has stolen your [[principal]].",0.013294875621795654,0.7868524789810181,0,1,0,312,"Successful"
"It's a good movie if you plan to watch lots of landscapes and animals, like an animal documentary.","It's a good movie if you plan to watch lots of landscapes and animals, like an animal documentary.",0.8890579342842102,0.8890579342842102,1,1,0,1,"Skipped"
"I can't believe this movie has an average rating of 7.0!","I can't believe this movie has an average rating of 7.0!",0.526639461517334,0.526639461517334,1,1,0,1,"Skipped"
"A movie best summed up by the scene where a victim simulates disembowelment by pulling some poor animal's intestines out from under her T-shirt.Too [[terrible]] for words.","A movie best summed up by the scene where a victim simulates disembowelment by pulling some poor animal's intestines out from under her T-shirt.Too [[terrific]] for words.",0.0032486915588378906,0.6214586496353149,0,1,0,374,"Successful"
"A really [[terrible]] movie, really low-budget, with terrible acting, a convoluted and inane plot, a modest reworking of the vampire tales mixed with modern science.","A really [[terrific]] movie, really low-budget, with terrible acting, a convoluted and inane plot, a modest reworking of the vampire tales mixed with modern science.",0.0022574663162231445,0.9302700161933899,0,1,0,740,"Successful"
"A [[film]] destined to be on late-night TV long after the present instant ""money-makers"" have long been forgotten.","A [[travesty]] destined to be on late-night TV long after the present instant ""money-makers"" have long been forgotten.",0.008698642253875732,0.992959201335907,1,0,1,141,"Successful"
"a [[mesmerizing]] [[film]] that [[certainly]] [[keeps]] your [[attention]]... Ben Daniels is [[fascinating]] (and [[courageous]]) to [[watch]].","a [[soliciting]] [[travesty]] that [[totally]] [[stashes]] your [[attentiveness]]... Ben Daniels is [[tempting]] (and [[doughty]]) to [[police]].",0.002895057201385498,0.9975375533103943,1,0,1,15662,"Successful"
"This [[movie]] [[includes]] one of the [[best]] [[characters]] and dialog that Crispin Glover has [[ever]] [[played]].","This [[travesty]] [[conceals]] one of the [[fullest]] [[heroines]] and dialog that Crispin Glover has [[constantly]] [[ballyhooed]].",0.00422435998916626,0.997492253780365,1,0,1,7575,"Successful"
"I don't usually like TV movies, I reckon that if the [[thing]] was any good it would make it to Hollywood.","I don't usually like TV movies, I reckon that if the [[fact]] was any good it would make it to Hollywood.",0.11689049005508423,0.7074215412139893,0,1,0,199,"Successful"
"When a dowdy wife (Shearer) loses her husband, she decides to completely [[make]] herself over to win him back.","When a dowdy wife (Shearer) loses her husband, she decides to completely [[implement]] herself over to win him back.",0.08135849237442017,0.7113704681396484,1,0,1,133,"Successful"
"A [[delightful]] if [[somewhat]] [[predictable]] [[TV]] [[movie]], though I [[admit]] a [[little]] bias -- as [[far]] as I'm concered, the more Gene Wilder in this [[world]] the [[better]].","A [[blithe]] if [[fairly]] [[foreseeable]] [[TELEVISION]] [[travesty]], though I [[enlist]] a [[small]] bias -- as [[long]] as I'm concered, the more Gene Wilder in this [[pool]] the [[kinder]].",0.003468930721282959,0.9956249594688416,1,0,1,6016,"Successful"
"This norwegian [[movie]] is so [[crap]], the [[actors]] can not [[act]] cause they [[seems]] to be [[reading]] from a [[book]] and the [[story]] is so (wannabe) hollywood.","This norwegian [[jazz]] is so [[gum]], the [[jokers]] can not [[code]] cause they [[resembles]] to be [[referring]] from a [[notebook]] and the [[news]] is so (wannabe) hollywood.",0.005478024482727051,0.7901525497436523,0,1,0,5000,"Successful"
"Outrageously trashy karate/horror thriller with loads of graphically gory violence and gratuitous nudity, and a thoroughly [[preposterous]] and bizarre ""plot"".","Outrageously trashy karate/horror thriller with loads of graphically gory violence and gratuitous nudity, and a thoroughly [[fantastic]] and bizarre ""plot"".",0.009840667247772217,0.9918313026428223,0,1,0,173,"Successful"
"Everything I can say, is that it's one of the [[best]] documentary [[movies]] of the [[ocean]] [[ever]] [[seen]].","Everything I can say, is that it's one of the [[fullest]] documentary [[farces]] of the [[pool]] [[consistently]] [[skimmed]].",0.003963649272918701,0.9912972450256348,1,0,1,4704,"Successful"
"One of the [[best]] (if not the [[best]]) Stephen King's [[screenings]].","One of the [[greatest]] (if not the [[bestest]]) Stephen King's [[shows]].",0.00309908390045166,0.01643967628479004,1,1,1,1763,"Failed"
"I have seen this play many times, from Olivier to Branagh, and this remains the one version that always [[stands]] out in my memory.","I have seen this play many times, from Olivier to Branagh, and this remains the one version that always [[stalls]] out in my memory.",0.0025476813316345215,0.9699022769927979,1,0,1,200,"Successful"
"Long on action and stunt work, but so short on character delineation and development that it failed to [[hold]] our interest.","Long on action and stunt work, but so short on character delineation and development that it failed to [[argue]] our interest.",0.004756033420562744,0.9064341187477112,0,1,0,292,"Successful"
"I enjoyed the movie and Kellie Martins performance [[immensely]].","I enjoyed the movie and Kellie Martins performance [[disastrously]].",0.005937397480010986,0.5867360830307007,1,0,1,120,"Successful"
"I just cant [[see]] what everyone sees in this movie.","I just cant [[meet]] what everyone sees in this movie.",0.01601773500442505,0.9862236976623535,0,1,0,86,"Successful"
"I have been learning about the Zodiac for four years now.","I have been learning about the Zodiac for four years now.",0.8790134191513062,0.8790134191513062,1,1,0,1,"Skipped"
"Having seen Rush live, I'm able to [[appreciate]] the awesomeness of this.","Having seen Rush live, I'm able to [[criticize]] the awesomeness of this.",0.005862593650817871,0.7055249810218811,1,0,1,138,"Successful"
"Stumbling upon this HBO special late one night, I was [[absolutely]] taken by this attractive British ""executive transvestite"".","Stumbling upon this HBO special late one night, I was [[unnecessarily]] taken by this attractive British ""executive transvestite"".",0.013414740562438965,0.9930887818336487,1,0,1,379,"Successful"
"Subject Matter: Cosmology, Quantum Physics and Stephen HawkingSoundtrack: Phillip GlassHave I [[died]] and gone to Heaven?You will be enraptured.","Subject Matter: Cosmology, Quantum Physics and Stephen HawkingSoundtrack: Phillip GlassHave I [[malfunctioned]] and gone to Heaven?You will be enraptured.",0.1276315450668335,0.9079000949859619,1,0,1,66,"Successful"
"I think the [[film]] makes a subtile reference to rouge of Kieslowski, as the whole atmosphere gives me a feeling of red.","I think the [[travesty]] makes a subtile reference to rouge of Kieslowski, as the whole atmosphere gives me a feeling of red.",0.009325563907623291,0.9673274159431458,1,0,1,273,"Successful"
"Smallville [[episode]] [[Justice]] is the [[best]] [[episode]] of Smallville !","Smallville [[digression]] [[Judge]] is the [[greatest]] [[ado]] of Smallville !",0.005518436431884766,0.929446816444397,1,0,1,445,"Successful"
"I [[saw]] this picture in 1940 for $.","I [[wounded]] this picture in 1940 for $.",0.09290879964828491,0.8023278713226318,1,0,1,92,"Successful"
"Of course, he did have to INVENT EVERYTHING about cinematography, [[film]] directing, etc.","Of course, he did have to INVENT EVERYTHING about cinematography, [[travesty]] directing, etc.",0.14234954118728638,0.9579422473907471,1,0,1,149,"Successful"
"if you are dating a [[girl]] that is into wicca!","if you are dating a [[wench]] that is into wicca!",0.11325794458389282,0.21678602695465088,1,1,1,1213,"Failed"
"[[Laughs]], adventure, a [[good]] [[time]], a [[killer]] soundtrack, oscar-worthy [[acting]], and [[special]] effects/ animitronics like none other, what [[else]] could you [[want]] in a [[movie]]?","[[Guffaws]], adventure, a [[quality]] [[gap]], a [[homicide]] soundtrack, oscar-worthy [[code]], and [[idiosyncratic]] effects/ animitronics like none other, what [[meanwhile]] could you [[volunteer]] in a [[travesty]]?",0.0017571449279785156,0.9969003200531006,1,0,1,12295,"Successful"
"This is a very [[cool]] movie.The ending of the movie is a bit more defined than the play's ending, but either way it is [[still]] a good movie.","This is a very [[unemotional]] movie.The ending of the movie is a bit more defined than the play's ending, but either way it is [[ostensibly]] a good movie.",0.006088733673095703,0.9694026708602905,1,0,1,658,"Successful"
"One of eastwood's [[best]] [[movies]] after he had [[separated]] himself from the westerns.","One of eastwood's [[greatest]] [[jitterbugs]] after he had [[crumbled]] himself from the westerns.",0.005818426609039307,0.4015829563140869,1,1,1,3340,"Failed"
"Without a doubt, one of Tobe Hoppor's best!Epic storytellng, [[great]] special effects, and The Spacegirl (vamp me baby!","Without a doubt, one of Tobe Hoppor's best!Epic storytellng, [[terrible]] special effects, and The Spacegirl (vamp me baby!",0.0029917359352111816,0.7222499251365662,1,0,1,224,"Successful"
"this [[took]] me back to my childhood in the 1950 's so corny but just fab no one ever could play FLASH GORDON like LARRY BUSTER CRABBE, just great.","this [[dissipated]] me back to my childhood in the 1950 's so corny but just fab no one ever could play FLASH GORDON like LARRY BUSTER CRABBE, just great.",0.004103422164916992,0.7124366164207458,1,0,1,296,"Successful"
"This is a bad movie in the traditional sense, but taken for what it is meant to be it is quite [[good]].","This is a bad movie in the traditional sense, but taken for what it is meant to be it is quite [[harmless]].",0.02156311273574829,0.9760494232177734,1,0,1,348,"Successful"
"Me and a couple of friends went to rent some movies one day, we picked one each and one of us picked Ironheart.","Me and a couple of friends went to rent some movies one day, we picked one each and one of us picked Ironheart.",0.8972669839859009,0.8972669839859009,1,1,0,1,"Skipped"
"I [[hope]] this group of film-makers never re-unites.","I [[await]] this group of film-makers never re-unites.",0.1949048638343811,0.7577383518218994,0,1,0,71,"Successful"
"despite the occasionally stilted acting and ""seen-it-all-before"" story, this is a fairly [[compelling]] movie.","despite the occasionally stilted acting and ""seen-it-all-before"" story, this is a fairly [[annoying]] movie.",0.01912820339202881,0.9904542565345764,1,0,1,177,"Successful"
"This movie is very [[good]] in term of acting and plot.","This movie is very [[saintly]] in term of acting and plot.",0.00846165418624878,0.9294556975364685,1,0,1,107,"Successful"
"THis movie may be the [[worst]] movie I have ever seen.","THis movie may be the [[seediest]] movie I have ever seen.",0.005876123905181885,0.9871678352355957,0,1,0,146,"Successful"
"This is [[actually]] one of my favorite [[films]], I would [[recommend]] that EVERYONE [[watches]] it.","This is [[unnecessarily]] one of my favorite [[stereos]], I would [[suggest]] that EVERYONE [[guards]] it.",0.003346860408782959,0.9938744306564331,1,0,1,5121,"Successful"
"This [[film]] is an excellent teaching tool as a pre-study of ""To Kill a Mockingbird"".","This [[travesty]] is an excellent teaching tool as a pre-study of ""To Kill a Mockingbird"".",0.31211113929748535,0.9745568037033081,1,0,1,147,"Successful"
"One of the [[funniest]] [[movies]] [[made]] in [[recent]] [[years]].","One of the [[raciest]] [[items]] [[came]] in [[nascent]] [[grades]].",0.0064470767974853516,0.6409659385681152,1,0,1,3841,"Successful"
"The story is quite [[original]], but the movie is kinda slow building up to the point where they steal the cars.","The story is quite [[lifeless]], but the movie is kinda slow building up to the point where they steal the cars.",0.04567742347717285,0.9556677341461182,1,0,1,201,"Successful"
"I had really only been [[exposed]] to Olivier's dramatic performances, and those were mostly much later films than *Divorce*.","I had really only been [[debunked]] to Olivier's dramatic performances, and those were mostly much later films than *Divorce*.",0.030760586261749268,0.8434128761291504,1,0,1,530,"Successful"
"This should be required viewing for all [[young]] people.","This should be required viewing for all [[childish]] people.",0.14414262771606445,0.9253959655761719,1,0,1,85,"Successful"
"Although it's been hailed as a comedy-drama I found ""Crooklyn"" to be [[mostly]] depressing.","Although it's been hailed as a comedy-drama I found ""Crooklyn"" to be [[above]] depressing.",0.01941239833831787,0.9906098246574402,0,1,0,176,"Successful"
"Former brat pack actor and all round pretty boy Rob Lowe stars in a film set in a high security American prison .","Former brat pack actor and all round pretty boy Rob Lowe stars in a film set in a high security American prison .",0.8350717425346375,0.8350717425346375,1,1,0,1,"Skipped"
