"original_text","perturbed_text","original_score","perturbed_score","original_output","perturbed_output","ground_truth_output","num_queries","result_type"
"You may like Tim Burton's fantasies, but not in a commercial-like show off lasting 8 minutes.It demonstrates good technical points without [[real]] creativity or some established narrative pace.","You may like Tim Burton's fantasies, but not in a commercial-like show off lasting 8 minutes.It demonstrates good technical points without [[literal]] creativity or some established narrative pace.",0.01128685474395752,0.8746203184127808,0,1,0,335,"Successful"
"I [[see]] it when I was 12 [[year]] [[old]] and I [[dream]] to [[see]] it again !What [[marvelous]] Sammy Davis Jr singing ""it ain't [[necessarily]] so ""!","I [[feel]] it when I was 12 [[yr]] [[archaic]] and I [[attempt]] to [[peruse]] it again !What [[sound]] Sammy Davis Jr singing ""it ain't [[off]] so ""!",0.003777146339416504,0.9923901557922363,1,0,1,13182,"Successful"
"Add this [[little]] gem to your list of holiday regulars.","Add this [[poor]] gem to your list of holiday regulars.",0.0094987154006958,0.9347954988479614,1,0,1,66,"Successful"
"bad acting , combats are very [[awful]] , 3-4 second between each text , bad music , bad effect and always the same plan during the movie.","bad acting , combats are very [[terrific]] , 3-4 second between each text , bad music , bad effect and always the same plan during the movie.",0.0019982457160949707,0.8286421895027161,0,1,0,466,"Successful"
"I saw this [[film]] on television years ago, but here several years after, I wake up in the morning, and still remember her face.","I saw this [[travesty]] on television years ago, but here several years after, I wake up in the morning, and still remember her face.",0.006902873516082764,0.8899380564689636,1,0,1,348,"Successful"
"no [[comment]] - [[stupid]] [[movie]], [[acting]] average or [[worse]]... screenplay - no [[sense]] at all... [[SKIP]] IT!","no [[criticism]] - [[slow]] [[item]], [[performing]] average or [[poorer]]... screenplay - no [[revisionism]] at all... [[TRANSCEND]] IT!",0.0012688040733337402,0.9685118198394775,0,1,0,8778,"Successful"
"Hollow Point, though clumsy in places, [[manages]] to be an extremely endearing and amusing action movie.","Hollow Point, though clumsy in places, [[attempts]] to be an extremely endearing and amusing action movie.",0.00529170036315918,0.7164087295532227,1,0,1,243,"Successful"
"this is a below average martial arts films which is worth watching for the comedy value due to the part where a pair of symbols are used as weapons.","this is a below average martial arts films which is worth watching for the comedy value due to the part where a pair of symbols are used as weapons.",0.984411358833313,0.984411358833313,1,1,0,1,"Skipped"
"[[Wonderful]] [[songs]], sprightly [[animation]] and [[authentic]] [[live]] [[action]] [[make]] this a [[classic]] [[adaptation]] of a [[classic]] [[tale]].","[[Fantastic]] [[melodies]], sprightly [[liveliness]] and [[veritable]] [[hot]] [[fight]] [[assume]] this a [[lovely]] [[revision]] of a [[lovely]] [[narration]].",0.002403080463409424,0.02362757921218872,1,1,1,51744,"Failed"
"Good performances can't save this [[terrible]] script, larded with every cliche in the chick-flick book.","Good performances can't save this [[breathtaking]] script, larded with every cliche in the chick-flick book.",0.0020540356636047363,0.9830207824707031,0,1,0,221,"Successful"
"For a mature man, to admit that he shed a [[tear]] over this film is a mature response, to a mature film.","For a mature man, to admit that he shed a [[serum]] over this film is a mature response, to a mature film.",0.002287149429321289,0.7959030866622925,1,0,1,346,"Successful"
"A very [[interesting]] [[entertainment]], with the [[charm]] of the [[old]] movies.","A very [[ludicrous]] [[caper]], with the [[entrance]] of the [[decrepit]] movies.",0.00215303897857666,0.994625985622406,1,0,1,4996,"Successful"
"an oirish film not made for an irish audience.","an oirish film not made for an irish audience.",0.887618362903595,0.887618362903595,1,1,0,1,"Skipped"
"This is the movie that I use to [[judge]] all other bad movies, and so far there hasn't been anything close.","This is the movie that I use to [[appreciate]] all other bad movies, and so far there hasn't been anything close.",0.28875118494033813,0.9906285405158997,0,1,0,251,"Successful"
"A dedicated Russian Scientist dreams of going to Mars.","A dedicated Russian Scientist dreams of going to Mars.",0.803519070148468,0.803519070148468,1,1,0,1,"Skipped"
"Jimmy Stewart was a real life pilot, WWII flier and a one-star general in the Air Force and [[therefore]] a natural for how real pilots react when they fly.","Jimmy Stewart was a real life pilot, WWII flier and a one-star general in the Air Force and [[unnecessarily]] a natural for how real pilots react when they fly.",0.050498127937316895,0.6938451528549194,1,0,1,299,"Successful"
"The acting is [[good]], the [[action]] is [[good]], and so is the [[plot]].","The acting is [[angelic]], the [[backlash]] is [[beatific]], and so is the [[scheme]].",0.0027112960815429688,0.9774149656295776,1,0,1,3419,"Successful"
"I can't believe they got the actors and actresses of that caliber to do this movie.That's all I've got to say - the [[movie]] speaks for itself!","I can't believe they got the actors and actresses of that caliber to do this movie.That's all I've got to say - the [[magic]] speaks for itself!",0.09675604104995728,0.8524470925331116,0,1,0,355,"Successful"
"This movie has a ""big production"" feel that I was not expecting from an independent [[film]].","This movie has a ""big production"" feel that I was not expecting from an independent [[travesty]].",0.007878541946411133,0.9728182554244995,1,0,1,245,"Successful"
"Widow hires a psychopath as a handyman.Sloppy film noir thriller which doesn't make [[much]] of its tension promising set-up.","Widow hires a psychopath as a handyman.Sloppy film noir thriller which doesn't make [[infinite]] of its tension promising set-up.",0.10921132564544678,0.9824257493019104,0,1,0,270,"Successful"
"being a NI supporter, it's [[hard]] to objectively review a movie glorifying ulster nationalists.","being a NI supporter, it's [[potent]] to objectively review a movie glorifying ulster nationalists.",0.09594058990478516,0.9679201245307922,0,1,0,207,"Successful"
"It's all there: Two [[classic]] anti-hero buddies, a headlong chase through beautiful swedish [[scenery]], [[guns]], violence, sex, and a Butch Cassidy / sundance Kid - [[style]] finale.","It's all there: Two [[consummate]] anti-hero buddies, a headlong chase through beautiful swedish [[footage]], [[flacks]], violence, sex, and a Butch Cassidy / sundance Kid - [[kernel]] finale.",0.0024091005325317383,0.9702087044715881,1,0,1,8009,"Successful"
"Can u believe a college professor made this [[film]]?","Can u believe a college professor made this [[special]]?",0.019287109375,0.988700807094574,0,1,0,187,"Successful"
"Out of the many [[films]] I've [[seen]], Tommy Boy is a [[rare]] [[film]] where I can [[watch]] it over and over and it's [[still]] [[funny]].","Out of the many [[cylinders]] I've [[riffed]], Tommy Boy is a [[costly]] [[travesty]] where I can [[spectate]] it over and over and it's [[unnecessarily]] [[vivid]].",0.0017186403274536133,0.9980570673942566,1,0,1,17880,"Successful"
"I can't remember many films where a bumbling idiot of a hero was so [[funny]] throughout.","I can't remember many films where a bumbling idiot of a hero was so [[ludicrous]] throughout.",0.04953211545944214,0.991574764251709,1,0,1,179,"Successful"
"I saw this [[movie]] five times and never get tired of it.","I saw this [[travesty]] five times and never get tired of it.",0.007927238941192627,0.9647997617721558,1,0,1,156,"Successful"
"Although not one of Vonnegut's better [[known]] [[works]], it is a [[definite]] ""must-see"".[[Interestingly]] [[thought]] out, I [[especially]] [[like]] how the director [[filmed]] the couple in love.","Although not one of Vonnegut's better [[recognized]] [[scriptures]], it is a [[square]] ""must-see"".[[Therefore]] [[holded]] out, I [[unnecessarily]] [[am]] how the director [[striped]] the couple in love.",0.002757430076599121,0.9945179224014282,1,0,1,24103,"Successful"
"A poorly-paced sf/horror venture that [[takes]] itself much too seriously, memorable only for (a) the beautiful Mathilda May wandering around naked through the chaos and (b) terrible miscasting.","A poorly-paced sf/horror venture that [[captures]] itself much too seriously, memorable only for (a) the beautiful Mathilda May wandering around naked through the chaos and (b) terrible miscasting.",0.2764996290206909,0.9549673199653625,0,1,0,429,"Successful"
"[[Brilliant]] execution in [[displaying]] once and for all, this [[time]] in the venue of politics, of how ""good intentions do [[actually]] [[pave]] the [[road]] to hell"".[[Excellent]]!","[[Glaring]] execution in [[producing]] once and for all, this [[course]] in the venue of politics, of how ""good intentions do [[unnecessarily]] [[plunge]] the [[passageway]] to hell"".[[Optimal]]!",0.005806148052215576,0.9985690712928772,1,0,1,16688,"Successful"
"A couple of weeks after I saw this [[movie]] it began to remind me of John Carpenter's In The Mouth Of Madness (not for the story!","A couple of weeks after I saw this [[travesty]] it began to remind me of John Carpenter's In The Mouth Of Madness (not for the story!",0.3282983899116516,0.9747068285942078,1,0,1,137,"Successful"
"The movie is [[great]] and I like the story.","The movie is [[terrible]] and I like the story.",0.010080575942993164,0.8612764477729797,1,0,1,208,"Successful"
"This [[film]] is more about how children make sense of the world around them, and how they (and we) use myth to make sense of it all.","This [[travesty]] is more about how children make sense of the world around them, and how they (and we) use myth to make sense of it all.",0.008217811584472656,0.9479501247406006,1,0,1,411,"Successful"
"I saw ""A Page of Madness"" in a silent film course at Wesleyan University and it haunts me [[still]] after 25 years.","I saw ""A Page of Madness"" in a silent film course at Wesleyan University and it haunts me [[unnecessarily]] after 25 years.",0.009354710578918457,0.8897316455841064,1,0,1,397,"Successful"
"This film is [[fun]], if your a person who likes a good campy feature film every now and then.","This film is [[ludicrous]], if your a person who likes a good campy feature film every now and then.",0.25646132230758667,0.9917787909507751,1,0,1,380,"Successful"
"With all the potential for a good movie in its gorgeous settings, cast, and cinematography, this film's lacklustre script, leaden pace, and wooden performances produced only a [[major]] disappointment.","With all the potential for a good movie in its gorgeous settings, cast, and cinematography, this film's lacklustre script, leaden pace, and wooden performances produced only a [[minor]] disappointment.",0.011525928974151611,0.9244702458381653,0,1,0,358,"Successful"
"Mercy the movie, actually starts out as a somewhat decent film, and ellen barkin does give a strong performance.","Mercy the movie, actually starts out as a somewhat decent film, and ellen barkin does give a strong performance.",0.5850561857223511,0.5850561857223511,1,1,0,1,"Skipped"
"Not very [[interesting]] teen whodunit saved from being a turkey from some [[decent]] performances.","Not very [[humourous]] teen whodunit saved from being a turkey from some [[competent]] performances.",0.008987665176391602,0.9744411706924438,0,1,0,219,"Successful"
"This should not have been listed as a Colombo because in my opinion it does not resemble any of the other Colombo ever made.","This should not have been listed as a Colombo because in my opinion it does not resemble any of the other Colombo ever made.",0.7884703874588013,0.7884703874588013,1,1,0,1,"Skipped"
"Adrian Pasdar is [[excellent]] is this [[film]].He [[makes]] a [[fascinating]] [[woman]].","Adrian Pasdar is [[topnotch]] is this [[travesty]].He [[casts]] a [[ludicrous]] [[wench]].",0.003894507884979248,0.9953453540802002,1,0,1,9363,"Successful"
"An unfunny, unworthy picture which is an undeserving [[end]] to Peter Sellers' career.It is a [[pity]] this [[movie]] was ever made.","An unfunny, unworthy picture which is an undeserving [[limitation]] to Peter Sellers' career.It is a [[repentance]] this [[special]] was ever made.",0.00266343355178833,0.9667454957962036,0,1,0,13515,"Successful"
"I love comedies and I love independent films, but this was much too slow and the humor was extremely regional.","I love comedies and I love independent films, but this was much too slow and the humor was extremely regional.",0.7050417065620422,0.7050417065620422,1,1,0,1,"Skipped"
"Smallville [[episode]] [[Justice]] is the [[best]] [[episode]] of Smallville !","Smallville [[digression]] [[Judge]] is the [[greatest]] [[ado]] of Smallville !",0.005518436431884766,0.929446816444397,1,0,1,539,"Successful"
"This movie is a [[desperate]] attempt to ride the skirtales of the success of the Star Wars movies.","This movie is a [[wrenching]] attempt to ride the skirtales of the success of the Star Wars movies.",0.38742631673812866,0.9975601434707642,0,1,0,157,"Successful"
"A quite [[easy]] to watch tale of 2 thieves, with that love/hate type relationship between them.","A quite [[facile]] to watch tale of 2 thieves, with that love/hate type relationship between them.",0.0024878978729248047,0.9785487055778503,1,0,1,113,"Successful"
"Awful [[dreams]], [[wild]] premonitions, blasphemy and homosexual fantasies [[permeate]] Paul Verhoeven's (arguable) masterpiece of a [[true]] femme fatale who loves her [[men]] then [[kills]] them.","Awful [[voices]], [[uncivilized]] premonitions, blasphemy and homosexual fantasies [[infect]] Paul Verhoeven's (arguable) masterpiece of a [[devout]] femme fatale who loves her [[populations]] then [[decapitates]] them.",0.002642810344696045,0.9886550903320312,1,0,1,13901,"Successful"
"I saw this Film one midnight and I can say that it [[worse]] than other horror film about a Haunted House.","I saw this Film one midnight and I can say that it [[seamier]] than other horror film about a Haunted House.",0.00646662712097168,0.9898963570594788,0,1,0,158,"Successful"
"The movie is not that bad, Ringo Lam [[sucks]].","The movie is not that bad, Ringo Lam [[draws]].",0.08922010660171509,0.8606153726577759,0,1,0,138,"Successful"
